{"$id":"https://cumulativewebinc.github.io/cwi-link-sentinel/results.schema.json","$schema":"http://json-schema.org/draft-07/schema#","description":"cwi.link-scan/1.0 — one scan run over cwi.link-record/1.0 records. Statuses are LIVE, REDIRECT, DEAD, ERROR, UNCHECKED. Truth is VERIFIED only for LIVE; every other status is UNVERIFIED. Nothing is marked live without a real check.","properties":{"counts":{"additionalProperties":false,"properties":{"DEAD":{"minimum":0,"type":"integer"},"ERROR":{"minimum":0,"type":"integer"},"LIVE":{"minimum":0,"type":"integer"},"REDIRECT":{"minimum":0,"type":"integer"},"UNCHECKED":{"minimum":0,"type":"integer"}},"required":["LIVE","REDIRECT","DEAD","ERROR","UNCHECKED"],"type":"object"},"duration_s":{"type":"number"},"engine":{"pattern":"^cwi-link-sentinel/","type":"string"},"finished_at":{"format":"date-time","type":"string"},"record_count":{"minimum":1,"type":"integer"},"results":{"items":{"properties":{"checked_at":{"format":"date-time","type":"string"},"evidence":{"type":"object"},"id":{"type":"string"},"kind":{"type":"string"},"label":{"type":"string"},"note":{"type":"string"},"source":{"minLength":1,"type":"string"},"status":{"enum":["LIVE","REDIRECT","DEAD","ERROR","UNCHECKED"]},"truth":{"enum":["VERIFIED","UNVERIFIED"]},"url":{"format":"uri","type":"string"}},"required":["id","label","url","kind","source","status","truth","evidence","note","checked_at"],"type":"object"},"minItems":1,"type":"array"},"schema":{"const":"cwi.link-scan/1.0"},"started_at":{"format":"date-time","type":"string"}},"required":["schema","engine","started_at","finished_at","record_count","counts","results"],"title":"CWI Link Sentinel scan result","type":"object"}