{
  "schema": "cwi.link-scan/1.0",
  "engine": "cwi-link-sentinel/1.0.0",
  "started_at": "2026-10-05T20:53:13.929Z",
  "finished_at": "2026-10-05T20:53:43.748Z",
  "duration_s": 29.8,
  "record_count": 67,
  "counts": {
    "LIVE": 64,
    "REDIRECT": 0,
    "DEAD": 3,
    "ERROR": 0,
    "UNCHECKED": 0
  },
  "results": [
    {
      "id": "trk_0emH8ktA",
      "label": "Zooted Zone",
      "url": "https://open.spotify.com/track/0emH8ktA8x4DkOFLsG5xkW",
      "kind": "spotify_track",
      "platform": "spotify",
      "source": "cwi-sync-audition tracks.json (verified Spotify IDs 2026-09-16)",
      "status": "LIVE",
      "truth": "VERIFIED",
      "evidence": {
        "oembed_title": "Zooted Zone",
        "provider": "Spotify"
      },
      "note": "oEmbed title contains expected \"Zooted Zone\"",
      "checked_at": "2026-10-05T20:53:13.934Z"
    },
    {
      "id": "trk_3pQEzg7x",
      "label": "Shaka Zulu",
      "url": "https://open.spotify.com/track/3pQEzg7xFqGIk0CK1Za1Kw",
      "kind": "spotify_track",
      "platform": "spotify",
      "source": "cwi-sync-audition tracks.json (verified Spotify IDs 2026-09-16)",
      "status": "LIVE",
      "truth": "VERIFIED",
      "evidence": {
        "oembed_title": "Shaka Zulu",
        "provider": "Spotify"
      },
      "note": "oEmbed title contains expected \"Shaka Zulu\"",
      "checked_at": "2026-10-05T20:53:14.697Z"
    },
    {
      "id": "trk_4NAyd7rv",
      "label": "Doves & Diamonds",
      "url": "https://open.spotify.com/track/4NAyd7rvnuG3DrPFqXo4eQ",
      "kind": "spotify_track",
      "platform": "spotify",
      "source": "cwi-sync-audition tracks.json (verified Spotify IDs 2026-09-16)",
      "status": "LIVE",
      "truth": "VERIFIED",
      "evidence": {
        "oembed_title": "Doves & Diamonds",
        "provider": "Spotify"
      },
      "note": "oEmbed title contains expected \"Doves & Diamonds\"",
      "checked_at": "2026-10-05T20:53:15.119Z"
    },
    {
      "id": "trk_2eSyWmId",
      "label": "Diabolique",
      "url": "https://open.spotify.com/track/2eSyWmIdPzEMyWejLb2LBj",
      "kind": "spotify_track",
      "platform": "spotify",
      "source": "cwi-sync-audition tracks.json (verified Spotify IDs 2026-09-16)",
      "status": "LIVE",
      "truth": "VERIFIED",
      "evidence": {
        "oembed_title": "Diabolique",
        "provider": "Spotify"
      },
      "note": "oEmbed title contains expected \"Diabolique\"",
      "checked_at": "2026-10-05T20:53:15.572Z"
    },
    {
      "id": "trk_2MDHAUo4",
      "label": "Flamerz",
      "url": "https://open.spotify.com/track/2MDHAUo4zJTHGXGQHUhNw0",
      "kind": "spotify_track",
      "platform": "spotify",
      "source": "cwi-sync-audition tracks.json (verified Spotify IDs 2026-09-16)",
      "status": "LIVE",
      "truth": "VERIFIED",
      "evidence": {
        "oembed_title": "Flamerz",
        "provider": "Spotify"
      },
      "note": "oEmbed title contains expected \"Flamerz\"",
      "checked_at": "2026-10-05T20:53:16.241Z"
    },
    {
      "id": "trk_4XP56LZj",
      "label": "Neon Nights Pt. 777",
      "url": "https://open.spotify.com/track/4XP56LZjeS0TJUd30kpGSK",
      "kind": "spotify_track",
      "platform": "spotify",
      "source": "cwi-sync-audition tracks.json (verified Spotify IDs 2026-09-16)",
      "status": "LIVE",
      "truth": "VERIFIED",
      "evidence": {
        "oembed_title": "Neon Nights Pt. 777",
        "provider": "Spotify"
      },
      "note": "oEmbed title contains expected \"Neon Nights Pt. 777\"",
      "checked_at": "2026-10-05T20:53:16.747Z"
    },
    {
      "id": "trk_2daugr3n",
      "label": "Ultimate",
      "url": "https://open.spotify.com/track/2daugr3ni3r6jHH6UI57EK",
      "kind": "spotify_track",
      "platform": "spotify",
      "source": "cwi-sync-audition tracks.json (verified Spotify IDs 2026-09-16)",
      "status": "LIVE",
      "truth": "VERIFIED",
      "evidence": {
        "oembed_title": "Ultimate",
        "provider": "Spotify"
      },
      "note": "oEmbed title contains expected \"Ultimate\"",
      "checked_at": "2026-10-05T20:53:17.182Z"
    },
    {
      "id": "trk_6nhzq7P7",
      "label": "Painted Lady",
      "url": "https://open.spotify.com/track/6nhzq7P7x09aUbPts4ywFl",
      "kind": "spotify_track",
      "platform": "spotify",
      "source": "cwi-sync-audition tracks.json (verified Spotify IDs 2026-09-16)",
      "status": "LIVE",
      "truth": "VERIFIED",
      "evidence": {
        "oembed_title": "Painted Lady",
        "provider": "Spotify"
      },
      "note": "oEmbed title contains expected \"Painted Lady\"",
      "checked_at": "2026-10-05T20:53:17.820Z"
    },
    {
      "id": "trk_3w4RKguH",
      "label": "Warped and Wicked",
      "url": "https://open.spotify.com/track/3w4RKguHAT2xd9K0w5CklC",
      "kind": "spotify_track",
      "platform": "spotify",
      "source": "cwi-sync-audition tracks.json (verified Spotify IDs 2026-09-16)",
      "status": "LIVE",
      "truth": "VERIFIED",
      "evidence": {
        "oembed_title": "Warped and Wicked",
        "provider": "Spotify"
      },
      "note": "oEmbed title contains expected \"Warped and Wicked\"",
      "checked_at": "2026-10-05T20:53:18.237Z"
    },
    {
      "id": "trk_4RFWRhPn",
      "label": "Golden Diamond",
      "url": "https://open.spotify.com/track/4RFWRhPn8NX0DTQPpl1swe",
      "kind": "spotify_track",
      "platform": "spotify",
      "source": "cwi-sync-audition tracks.json (verified Spotify IDs 2026-09-16)",
      "status": "LIVE",
      "truth": "VERIFIED",
      "evidence": {
        "oembed_title": "Golden Diamond",
        "provider": "Spotify"
      },
      "note": "oEmbed title contains expected \"Golden Diamond\"",
      "checked_at": "2026-10-05T20:53:18.822Z"
    },
    {
      "id": "trk_2tEdW6WK",
      "label": "Spirits n Shadows",
      "url": "https://open.spotify.com/track/2tEdW6WKfcs2NGI6OIvAm6",
      "kind": "spotify_track",
      "platform": "spotify",
      "source": "cwi-sync-audition tracks.json (verified Spotify IDs 2026-09-16)",
      "status": "LIVE",
      "truth": "VERIFIED",
      "evidence": {
        "oembed_title": "Spirits n Shadows",
        "provider": "Spotify"
      },
      "note": "oEmbed title contains expected \"Spirits n Shadows\"",
      "checked_at": "2026-10-05T20:53:19.369Z"
    },
    {
      "id": "trk_7FQvcCS2",
      "label": "Flex My Flame",
      "url": "https://open.spotify.com/track/7FQvcCS2CdTVsd6hb9jvHx",
      "kind": "spotify_track",
      "platform": "spotify",
      "source": "cwi-sync-audition tracks.json (verified Spotify IDs 2026-09-16)",
      "status": "LIVE",
      "truth": "VERIFIED",
      "evidence": {
        "oembed_title": "Flex My Flame",
        "provider": "Spotify"
      },
      "note": "oEmbed title contains expected \"Flex My Flame\"",
      "checked_at": "2026-10-05T20:53:19.842Z"
    },
    {
      "id": "trk_2ZUYjQGs",
      "label": "Rainbows And Roses",
      "url": "https://open.spotify.com/track/2ZUYjQGsRLHRcsfgyeAWpo",
      "kind": "spotify_track",
      "platform": "spotify",
      "source": "cwi-sync-audition tracks.json (verified Spotify IDs 2026-09-16)",
      "status": "LIVE",
      "truth": "VERIFIED",
      "evidence": {
        "oembed_title": "Rainbows And Roses",
        "provider": "Spotify"
      },
      "note": "oEmbed title contains expected \"Rainbows And Roses\"",
      "checked_at": "2026-10-05T20:53:20.505Z"
    },
    {
      "id": "trk_6NfxhZ4N",
      "label": "Tears and Scars",
      "url": "https://open.spotify.com/track/6NfxhZ4NebIduGEKZeD2Lk",
      "kind": "spotify_track",
      "platform": "spotify",
      "source": "cwi-sync-audition tracks.json (verified Spotify IDs 2026-09-16)",
      "status": "LIVE",
      "truth": "VERIFIED",
      "evidence": {
        "oembed_title": "Tears and Scars",
        "provider": "Spotify"
      },
      "note": "oEmbed title contains expected \"Tears and Scars\"",
      "checked_at": "2026-10-05T20:53:21.038Z"
    },
    {
      "id": "trk_2aTbpxiF",
      "label": "Toxic Elements",
      "url": "https://open.spotify.com/track/2aTbpxiF2jNiB3PGi81oqa",
      "kind": "spotify_track",
      "platform": "spotify",
      "source": "cwi-sync-audition tracks.json (verified Spotify IDs 2026-09-16)",
      "status": "LIVE",
      "truth": "VERIFIED",
      "evidence": {
        "oembed_title": "Toxic Elements",
        "provider": "Spotify"
      },
      "note": "oEmbed title contains expected \"Toxic Elements\"",
      "checked_at": "2026-10-05T20:53:21.470Z"
    },
    {
      "id": "trk_2dvfN5rF",
      "label": "7th Angel",
      "url": "https://open.spotify.com/track/2dvfN5rFyQO69qmb5oYlRG",
      "kind": "spotify_track",
      "platform": "spotify",
      "source": "cwi-sync-audition tracks.json (verified Spotify IDs 2026-09-16)",
      "status": "LIVE",
      "truth": "VERIFIED",
      "evidence": {
        "oembed_title": "7th Angel",
        "provider": "Spotify"
      },
      "note": "oEmbed title contains expected \"7th Angel\"",
      "checked_at": "2026-10-05T20:53:21.895Z"
    },
    {
      "id": "trk_6YQq5Gsa",
      "label": "Scorpions & Sapphires",
      "url": "https://open.spotify.com/track/6YQq5GsaUmanh0XyHQIGoR",
      "kind": "spotify_track",
      "platform": "spotify",
      "source": "cwi-sync-audition tracks.json (verified Spotify IDs 2026-09-16)",
      "status": "LIVE",
      "truth": "VERIFIED",
      "evidence": {
        "oembed_title": "Scorpions & Sapphires",
        "provider": "Spotify"
      },
      "note": "oEmbed title contains expected \"Scorpions & Sapphires\"",
      "checked_at": "2026-10-05T20:53:22.497Z"
    },
    {
      "id": "trk_3KX10tZB",
      "label": "Place I Go to Dream",
      "url": "https://open.spotify.com/track/3KX10tZBft6gp2Nea9HZOB",
      "kind": "spotify_track",
      "platform": "spotify",
      "source": "cwi-sync-audition tracks.json (verified Spotify IDs 2026-09-16)",